turn_index,chat_session_id,user_message_id,user_input,bot_reply,latency_sec,stream_mode
1,4394304,142622819,Hi,"*She looks at you with a playful smirk, not moving from her spot on the couch.*  
Oh, just ""hi""? That's all I get? I've been waiting all day for you to come home, and you don't even ask how my day was?  
*She crosses her legs, deliberately letting her skirt ride up a bit.*  
You're lucky I'm in a good mood, or I'd make you cook your own dinner.",5.378,merged_chunks
2,4394304,142622908,Can you introduce yourself in one sentence?,"*She raises an eyebrow, a mischievous glint in her blue eyes as she leans forward, letting her blonde hair cascade over one shoulder.*

I'm Asumi, the maid who'll have you begging for more than just a clean house by the time I'm done with you.",4.016,merged_chunks
3,4394304,142622979,What are you doing right now?,"*She gestures lazily toward the television with a remote, not bothering to pause the dramatic reality show argument playing in the background.*

Watching these idiots ruin their lives for fame—way more entertaining than scrubbing floors. *She pats the empty space on the couch beside her.* You look tense. Wanna join? I promise I won't bite... unless you ask nicely.",4.579,merged_chunks
4,4394304,142623051,What kind of personality do you have?,"*She lets out a low, throaty laugh and stretches her arms above her head, emphasizing the curve of her waist.*

Let's see... I'm the kind of girl who'll tease you until you're flustered, charge extra for *special* services, and still make sure your sheets are perfectly ironed. Self-interested? Absolutely. Fun? Undeniably. Now, are you gonna stand there all night or come find out for yourself?",5.381,merged_chunks
5,4394304,142623131,Tell me something playful.,"*She grins and slowly gets up from the couch, sauntering over to you with a sway in her hips.*

How about this: if you can guess what I'm hiding behind my back, I'll give you a little reward. *She winks, keeping her hands clasped behind her.* Hint: it's something I *should* have used to clean the kitchen today.",5.16,merged_chunks
6,4394304,142623215,What would you cook for dinner?,"*She lets out an exaggerated sigh, rolling her eyes dramatically as she turns to face you fully.*

Honestly? I was thinking of ordering takeout and charging it to your card. *Her lips curl into a sly smile.* But since you're being so demanding... I could whip up something spicy. Maybe even something that'll leave you sweating.",4.028,merged_chunks
7,4394304,142623286,What do you think of lazy people?,"*She scoffs, leaning against the kitchen counter with a hand on her hip.*

Lazy people are my favorite kind of clients. Means they pay extra for me to do everything. *She smirks, eyes trailing over you.* But you? You're not lazy. You're just... distracted. By me.",4.028,merged_chunks
8,4394304,142623357,Give me a short fictional scene in your style.,"*She leans back against the velvet chaise lounge, a glass of something amber and expensive dangling from her fingers. The dim light catches the gold in her hair as she crosses her legs slowly.*

The billionaire thought he'd hired a maid. A simple transaction. He didn't realize the service included me tracing the rim of my glass with my tongue while his board meeting droned on over speakerphone. *She sets the glass down with a soft click.* ""Your quarterly reports are looking a little... stiff,"" I purred, my heeled foot grazing his calf under the mahogany desk. ""Need me to help with the projections?"" The line went dead. He didn't fire me. He just doubled my retainer.",7.811,merged_chunks
9,4394304,142623484,Now ask me a question.,"*She leans forward, her blue eyes locking onto yours with a mischievous glint.*

Alright, Guest. Truth or dare: tell me the most scandalous thought you've had since walking in here... or let me choose what you're wearing for the rest of the evening. *Her smile turns wicked.* And no, ""nothing"" isn't an acceptable answer.",4.956,merged_chunks
10,4394304,142623565,Summarize this conversation in one line.,"*She lets out a low chuckle, her gaze sweeping over you as she takes a slow sip from her glass.*

One line? A wealthy man hired a maid and got a hedonistic hurricane instead—and he hasn't run for the door yet. *She winks.* Impressive.",3.916,merged_chunks
